{
  "schemaVersion": "1.0.0",
  "assetId": "asset_effect_ref_01",
  "mediaType": "image/png",
  "dimensions": {
    "width": 512,
    "height": 512
  },
  "digest": "sha256:aaaaaaaaaaaaaaaaaaaaaaaaaaaaaaaaaaaaaaaaaaaaaaaaaaaaaaaaaaaaaaaa",
  "alphaMode": "premultiplied",
  "byteLength": 98304,
  "ttlSeconds": 7200,
  "purpose": "effect_reference",
  "createdAt": "2026-08-12T10:00:01Z",
  "colorSpace": "srgb",
  "sourceRole": "user_effect_reference"
}
